recordID,category,focus,caption_fr,caption_en,caption_nl,additional_info_fr,additional_info_en,additional_info_nl,tokenized_length_fr,tokenized_length_en,tokenized_length_nl
6138,Dessin,colors,"Des personens autour d'un lit avec un homme musclé couché et malade, une femme sur ses genoux à côté du lit, un enfant debout à côté du lit","People around a bed with a muscular man lying and sick, a woman on her knees next to the bed, a child standing next to the bed","Mensen rond een bed met een gespierde man liggend en ziek, een vrouw op haar knieën naast het bed, een kind dat naast het bed staat",['Couleur noir et blanc'],['Black and white color'],['Zwart-wit kleur'],52,35,52
7572,Tableau,colors,"Un massacre, le chaos, la mort, un combat entre des hommes musclés et des mères, bébés, soldats","A massacre, chaos, death, a fight between muscular men and mothers, babies, soldiers","Een bloedbad, chaos, dood, een gevecht tussen gespierde mannen en moeders, baby's, soldaten",['Couleurs vives'],['Bright colors'],['Heldere kleuren'],37,22,40
2021,Dessin,colors,"Une jeune fille lisant un livre assise avec un chaton sur ses genoux, elle porte un tablier blanc, intérieur, cheveux attachés","A young girl reading a book sitting with a kitten on her knees, she wears a white apron, inner, hair tied","Een jong meisje leest een boek zittend met een kitten op haar knieën, ze draagt een wit schort, binnenste, haar gebonden",['Couleur neutre'],['Neutral color'],['Neutrale kleur'],44,28,45
6470,Dessin,colors,"L'assemblée générale, des politiciens, politique, pupitre, discours, intérieur","The general assembly, politicians, politics, desk, speeches, interior","De algemene vergadering, politici, politiek, bureau, toespraken, interieur",['Couleur noir et blanc'],['Black and white color'],['Zwart-wit kleur'],38,19,32
7695,Tableau,colors,"Intérieur avec une chaise, un fenêtre, une commode, une cheminée avec un poêle, casserole, lampe","Interior with a chair, a window, a dresser, a fireplace with a stove, pan, lamp","Interieur met een stoel, een raam, een dressoir, een open haard met een fornuis, pan, lamp",['Couleur neutre'],['Neutral color'],['Neutrale kleur'],38,24,35
1733,Tableau,colors,"Un invasion d'un village par des soldats, la guerre, village sous la neige, chaos, combat, attaque, foule","An invasion of a village by soldiers, war, village under snow, chaos, combat, attack, crowd","Een invasie van een dorp door soldaten, oorlog, dorp onder sneeuw, chaos, strijd, aanval, menigte",['Couleurs vives'],['Bright colors'],['Heldere kleuren'],37,25,42
4070,Tableau,colors,"Couloir d'une maison avec un escalier, porte ouverte en fond, parquet, intérieur","Corridor of a house with a staircase, open door in the back, parquet floor, interior","Corridor van een huis met een trap, open deur aan de achterkant, parketvloer, interieur",['Couleur neutre'],['Neutral color'],['Neutrale kleur'],32,23,33
992,Tableau,colors,"Portrait d'une femme qui regarde vers le bas, turban rouge, chapeau, bras croisés, oreille visible, robe brune","Portrait of a woman looking down, turban red, hat, crossed arms, visible ear, brown dress","Portret van een vrouw kijken naar beneden, tulband rood, hoed, gekruiste armen, zichtbaar oor, bruine jurk","['Couleurs sombres', 'Couleur rouge']","['Dark colors', 'Red color']","['Donkere kleuren', 'Rode kleur']",42,27,52
1853,Tableau,colors,"Une robe blanche sur un porte manteau, un mur avec des tableaux, un vase doré par terre, une commode avec une écharpe bleue, intérieur","A white dress on a coat door, a wall with paintings, a golden vase on the floor, a dresser with a blue scarf, interior","Een witte jurk op een jasdeur, een muur met schilderijen, een gouden vaas op de vloer, een dressoir met een blauwe sjaal, interieur",['Couleurs vives'],['Bright colors'],['Heldere kleuren'],45,32,53
7095,Dessin,colors,"Une ferme avec un fermier qui déplacent des vaches et deux chiens, des arbres, un toit en tuiles et une clôture en bois","A farm with a farmer moving cows and two dogs, trees, a tile roof and a wooden fence","Een boerderij met een boer die koeien en twee honden verplaatst, bomen, een tegeldak en een houten hek",['Couleur noir et blanc'],['Black and white color'],['Zwart-wit kleur'],43,26,42
5640,Tableau,colors,"Portrait d'un homme fatigué avec une barbe brune et une moustache brune, cheveux dégarnis, fourrure, col blanc","Portrait of a tired man with a brown beard and a brown mustache, degarnished hair, fur, white collar","Portret van een vermoeide man met een bruine baard en een bruine snor, gedegarneerd haar, bont, witte kraag",['Couleurs sombres'],['Dark colors'],['Donkere kleuren'],40,27,45
1829,Tableau,colors,"Portrait d'un jeune homme debout avec un costume rouge et une fine moustache, papier peint en fond, parquet, eventail en main, chemise rose","Portrait of a young man standing with a red suit and a fine mustache, background wallpaper, parquet floors, fan in hand, pink shirt","Portret van een jongeman staan met een rood pak en een fijne snor, achtergrond behang, parketvloeren, ventilator in de hand, roze shirt",['Couleurs vives'],['Bright colors'],['Heldere kleuren'],43,32,51
1369,Dessin,colors,"Une femme avec un sein visible et une longue robe regarde vers le haut avec un dague en main, défense, agression","A woman with a visible breast and a long dress looks up with a dagger in her hand, defense, aggression","Een vrouw met een zichtbare borst en een lange jurk kijkt omhoog met een dolk in haar hand, verdediging, agressie",['Couleur noir et blanc'],['Black and white color'],['Zwart-wit kleur'],37,28,45
8660,Tableau,colors,Un homme de face avec un habit bleu tient une bougie qui illumine son visage et le visage d'une fille à côté de lui,A man in front with a blue dress holds a candle that illuminates his face and the face of a girl next to him.,Een man aan de voorkant met een blauwe jurk heeft een kaars die zijn gezicht en het gezicht van een meisje naast hem verlicht.,"['Couleurs sombres', 'Couleur rouge']","['Dark colors', 'Red color']","['Donkere kleuren', 'Rode kleur']",46,33,55
4818,Tableau,colors,"Des moines agenouillés discutent, prières, religion","Kneeling monks discuss, prayers, religion","Knielen monniken bespreken, gebeden, religie","['Bicolore', 'Couleur rouge']","['Bicolor', 'Red color']","['Bicolor', 'Rode kleur']",24,15,23
3928,Tableau,colors,"Portrait d'une femme assise avec des cheveux noirs bouclés qui nettoie un palteau avec un chiffon, habit blanc et gris","Portrait of a woman sitting with curly black hair that cleans a palmeau with a rag, white and grey clothing","Portret van een vrouw zittend met krullend zwart haar dat reinigt een palmeau met een doek, wit en grijze kleding",['Couleur noir et blanc'],['Black and white color'],['Zwart-wit kleur'],39,29,46
8572,Tableau,colors,"Jésus mort avec autour de lui des hommes et des femmes qui prient et qui offrent des offrandes, religion, décès","Jesus died with around him men and women who pray and offer offerings, religion, death","Jezus stierf met om hem heen mannen en vrouwen die bidden en offeren, religie, dood",['Couleurs vives'],['Bright colors'],['Heldere kleuren'],41,21,36
3877,Dessin,colors,"Un femme nu se cache, cheveux noirs, femme assise sur un lit, nudité","A naked woman hides, black hair, woman sitting on a bed, naked","Een naakte vrouw verbergt zich, zwart haar, vrouw zittend op een bed, naakt",['Couleurs vives'],['Bright colors'],['Heldere kleuren'],29,19,37
5257,Dessin,colors,"Deux personnes assise à une table, une table vide avec une nappe blanche","Two people sitting at a table, an empty table with a white tablecloth","Twee mensen zitten aan een tafel, een lege tafel met een wit tafelkleed",['Couleur noir et blanc'],['Black and white color'],['Zwart-wit kleur'],24,22,30
7887,Dessin,colors,"Deux hommes avec des chapeaux en extérieur, jardin, homme qui s'occupent des plantes, chien assis, chateau en fond, arbres","Two men with hats outside, garden, man who cares for plants, sitting dog, castle in the back, trees","Twee mannen met hoeden buiten, tuin, man die zorgt voor planten, zittende hond, kasteel in de rug, bomen",['Couleur noir et blanc'],['Black and white color'],['Zwart-wit kleur'],44,29,45
7873,Dessin,colors,"Une femme en robe sophistiquée rencontre un homme avec une cape, deux autres hommes à ses côtés, un arbre au-dessus d'eux","A woman in a sophisticated dress meets a man with a cape, two other men by his side, a tree above them","Een vrouw in een verfijnde jurk ontmoet een man met een cape, twee andere mannen aan zijn zijde, een boom erboven.",['Couleur noir et blanc'],['Black and white color'],['Zwart-wit kleur'],46,30,48
2795,Sculpture,colors,"Sculpture de deux hommes musclés nus qui se battent, combat, violence","Sculpture of two muscular naked men fighting, fighting, violence","Beeldhouwkunst van twee gespierde naakte mannen vechten, vechten, geweld",['Couleur noir et blanc'],['Black and white color'],['Zwart-wit kleur'],24,17,36
4127,Tableau,colors,"Une femme nue assise sur le sol, une femme nue qui prend un fruit dans un arbre, un enfant nu assis par terre, forêt","A naked woman sitting on the ground, a naked woman taking a fruit from a tree, a naked child sitting on the ground, forest","Een naakte vrouw die op de grond zit, een naakte vrouw die een vrucht uit een boom haalt, een naakt kind dat op de grond zit, bos",['Couleur noir et blanc'],['Black and white color'],['Zwart-wit kleur'],43,33,55
1531,Tableau,colors,"Des bateaux sur la mer agitée, des grosses vaches, une tempête, des nuages, des voiliers","Boats on the turbulent sea, big cows, a storm, clouds, sailboats","Boten op de turbulente zee, grote koeien, een storm, wolken, zeilboten","['Couleurs sombres', 'Couleur verte']","['Dark colors', 'Green color']","['Donkere kleuren', 'Groene kleur']",41,23,37
6130,Tableau,colors,"Femem assise de dos avec un tablier qui joue du piano avec une partition devant elle, chaise, tabouret, intérieur","Female sitting back with an apron that plays the piano with a score in front of it, chair, stool, interior","Vrouwtje zit achterover met een schort dat piano speelt met een score er voor, stoel, kruk, interieur",['Couleur noir et blanc'],['Black and white color'],['Zwart-wit kleur'],40,29,40
5116,Tableau,colors,"Portrait d'une femme avec des cheveux noirs et une robe noire, fond vert, main qui se tiennent, cheveux attachés","Portrait of a woman with black hair and a black dress, green background, hand held, hair tied","Portret van een vrouw met zwart haar en een zwarte jurk, groene achtergrond, hand gehouden, haar gebonden",['Couleur verte'],['Green color'],['Groene kleur'],40,24,42
10793,Dessin,colors,"Un dessin d'un homme qui marche avec une faux, fermier, agriculteur, travail dans les champs","A drawing of a man who walks with a false farmer, farmer, work in the fields","Een tekening van een man die loopt met een valse boer, boer, werken in de velden",['Couleur noir et blanc'],['Black and white color'],['Zwart-wit kleur'],31,24,31
7292,Dessin,colors,"Un homme marchant vers sa maison, un chien courant dans la neige, un toit blanc, plusieurs arbres sans feuilles, des oiseaux dans le ciel","A man walking to his house, a dog running in the snow, a white roof, several trees without leaves, birds in the sky","Een man loopt naar zijn huis, een hond rent in de sneeuw, een wit dak, verschillende bomen zonder bladeren, vogels in de lucht",['Couleur neutre'],['Neutral color'],['Neutrale kleur'],46,31,49
8329,Dessin,colors,"Deux hommes assis portant de grands manteaux et des chapeaux discutent, homme vu de profil, homme vu de dos","Two men sitting in large coats and hats argue, man seen from profile, man seen from back","Twee mannen zitten in grote jassen en hoeden ruzie, man gezien vanuit profiel, man gezien van achteren",['Couleur noir et blanc'],['Black and white color'],['Zwart-wit kleur'],39,25,43
1394,Dessin,colors,"Une foule avec des hommes, des femmes et des enfants qui regardent un hpmme torse nu, guerrier, gagnant, vainqueur","A crowd with men, women and children watching a naked chest, warrior, winner, winner","Een menigte met mannen, vrouwen en kinderen kijken naar een naakte borst, krijger, winnaar, winnaar",['Couleur noir et blanc'],['Black and white color'],['Zwart-wit kleur'],42,24,46
10349,Dessin,colors,"Dessin d'une jeune femme avec un voile sur les cheveux, une robe, vu de côté","Drawing of a young woman with a veil on her hair, a dress, seen from the side","Tekening van een jonge vrouw met een sluier op haar haar, een jurk, gezien vanaf de zijkant",['Couleur noir et blanc'],['Black and white color'],['Zwart-wit kleur'],33,25,38
1317,Dessin,colors,"Un paysage avec des champs, une ville en arrière-plan avec une église et des maisons, des arbres et des buissons, un ciel blanc","A landscape with fields, a city in the background with a church and houses, trees and bushes, a white sky","Een landschap met velden, een stad op de achtergrond met een kerk en huizen, bomen en struiken, een witte lucht",['Couleur noir et blanc'],['Black and white color'],['Zwart-wit kleur'],44,29,44
7059,Dessin,colors,"Un texte entouré d'enfants anges avec des femmes nues, religion, sculpture, harpe","A text surrounded by children angels with naked women, religion, sculpture, harp","Een tekst omringd door kinderen engelen met naakte vrouwen, religie, beeldhouwkunst, harp","['Bicolore', 'Couleur rouge']","['Bicolor', 'Red color']","['Bicolor', 'Rode kleur']",34,22,39
1202,Tableau,colors,"Des hommes qui parlent à un sultan, des soldats, lances, intérieur, vêtements colorés","Men who talk to a sultan, soldiers, spears, inside, colorful clothes","Mannen die praten met een sultan, soldaten, speren, binnen, kleurrijke kleding",['Couleurs vives'],['Bright colors'],['Heldere kleuren'],35,19,32
4576,Tableau,content,"Un paysage avec un ciel nuageux, un lac en fond et un arbre en avant plan","A landscape with a cloudy sky, a lake in the background and a tree in the foreground","Een landschap met een bewolkte hemel, een meer op de achtergrond en een boom op de voorgrond",,,,24,20,31
5101,Tableau,content,"Un musicien joue de la guitare, il est assis, il a une moustache et il est jeune","A musician plays guitar, he's sitting, he's got a mustache and he's young.","Een muzikant speelt gitaar, hij zit, hij heeft een snor en hij is jong.",,,,27,21,29
7615,Tableau,content,"Un portrait d'un homme avec un chapeau noir et un habt noir, une rose derrière, moustache, ciel et batiment","A portrait of a man with a black hat and a black hat, a rose behind, mustache, sky and building","Een portret van een man met een zwarte hoed en een zwarte hoed, een roos achter, snor, lucht en gebouw",,,,33,25,38
10835,Dessin,content,"Un vieil homme barbu, musclé, un baton dans la main","An old bearded man, muscular, a baton in his hand","Een oude bebaarde man, gespierd, een stok in zijn hand",,,,18,14,21
4320,Tableau,content,"Un panier avec pommes sur une table avec une tasse, des fleurs dans un vase rouge, des livres, du papier peint","A basket with apples on a table with a cup, flowers in a red vase, books, wallpaper","Een mand met appels op een tafel met een kopje, bloemen in een rode vaas, boeken, behang",,,,33,22,29
6258,Tableau,content,Une femme de dos dans une forêt qui marche entre les arbres,A woman on her back in a forest that walks between the trees,Een vrouw op haar rug in een bos dat loopt tussen de bomen,,,,17,15,20
5495,Tableau,content,"Jésus qui parle à des personnes, un vieil homme avec une barbe blanche, une femme avec un foulard sur la tête, deux hommes d'église","Jesus speaking to people, an old man with a white beard, a woman with a scarf on her head, two churchmen","Jezus sprak met mensen, een oude man met een witte baard, een vrouw met een sjaal op haar hoofd, twee kerkmannen",,,,43,27,42
5761,Dessin,content,"Un enfant debout avec deux femmes, un homme de dos, un vase","A child standing with two women, a backman, a vase","Een kind met twee vrouwen, een backman, een vaas",,,,19,15,18
8397,Dessin,content,"Des personnes marchent de dos dans un port, le ciel nuageux, des mats en fond, des lampadaires","People walk from their backs in a harbour, cloudy sky, matts in the back, streetlights","Mensen lopen vanaf hun rug in een haven, bewolkte lucht, matten in de rug, straatlantaarns",,,,29,22,30
8729,Tableau,content,"Deux hommes qui regardent des livres, une femme avec un enfant, un marché dans la rue","Two men watching books, a woman with a child, a street market","Twee mannen kijken naar boeken, een vrouw met een kind, een straatmarkt",,,,25,16,27
10760,Sculpture,content,Une sculpture représentant des hommes qui travaillent,A sculpture representing men who work,Een beeld dat mannen vertegenwoordigt die werken,,,,17,8,17
1436,Tableau,content,"Une table avec de la nourriture, un homard, des biscuits, du pain, des olives, des verres","A table with food, lobster, biscuits, bread, olives, glasses","Een tafel met voedsel, kreeft, koekjes, brood, olijven, glazen",,,,28,16,27
1282,Tableau,content,"Une cabane au fond d'un jardin avec beaucoup d'arbres, de l'herbe","A cabin at the bottom of a garden with lots of trees, grass","Een hut op de bodem van een tuin met veel bomen, gras",,,,24,16,19
4286,Dessin,content,"Un fleuve avec deux bateaux, un pont et une ville, de la fumée qui sort des usines, un parc","A river with two boats, a bridge and a city, smoke coming out of the factories, a park","Een rivier met twee boten, een brug en een stad, rook die uit de fabrieken komt, een park",,,,30,23,30
10856,Dessin,content,"Un femme qui donne le sein à un nourisson, elle porte un chapeau ","A woman who gives breast to a nanny, she wears a hat","Een vrouw die borst geeft aan een kindermeisje, draagt een hoed",,,,20,15,23
6471,Tableau,content,"personnes sous une arche, rue, chevaux, chevalier, église dans le fond, homme en robe bleue","people under an arch, street, horses, knight, church in the background, man in blue dress","mensen onder een boog, straat, paarden, ridder, kerk op de achtergrond, man in blauwe jurk",,,,29,22,34
8131,Dessin,content,"Une femme avec un parapluie dans un parc, une ville en fond, des nuages, de l'herbe","A woman with an umbrella in a park, a town in the background, clouds, grass","Een vrouw met een paraplu in een park, een stad op de achtergrond, wolken, gras",,,,27,20,27
7151,Tableau,content,"Des ouvriers qui travaillent dans l'usine, un grand four, de la chaleur, de l'effort","Workers working in the factory, a big oven, heat, effort","Werknemers in de fabriek, een grote oven, warmte, inspanning",,,,32,15,22
3602,Dessin,content,"Une sculpture d'une tête, un homme avec une moustache","A head sculpture, a man with a mustache","Een hoofdsculptuur, een man met een snor",,,,16,11,15
1445,Tableau,content,"Une forêt avec une montagne en fond, un palmier, le ciel est bleu","A forest with a mountain in the background, a palm tree, the sky is blue","Een bos met een berg op de achtergrond, een palmboom, de lucht is blauw",,,,22,19,25
1111,Tableau,content,"Un bateau qui passe sous un pont, il y a de la fumée, une ville en fond","A boat that passes under a bridge, there's smoke, a city in the background","Een boot die onder een brug doorloopt, er is rook, een stad op de achtergrond",,,,25,19,26
10567,Tableau,content,Une femme nue qui s'habille,A naked woman who dresses,Een naakte vrouw die zich kleedt,,,,12,7,14
5649,Dessin,content,"Des anges, des chevaux, des lions, des poutres, de l'or, religion","Angels, horses, lions, beams, gold, religion","Engelen, paarden, leeuwen, balken, goud, religie",,,,24,13,20
4597,Tableau,content,"Un portrait d'un homme avec une moustache noir et des cheveux mi-long, un livre noir en main et un habit noir","A portrait of a man with a black mustache and mid-long hair, a black book in hand and a black dress","Een portret van een man met een zwarte snor en halflang haar, een zwart boek in de hand en een zwarte jurk",,,,31,26,37
1130,Tableau,content,"Un parc près du fleuve, un pont, des rues, un pont, des voitures et des bus, de la fumée et des nuages","A park near the river, a bridge, streets, a bridge, cars and buses, smoke and clouds","Een park bij de rivier, een brug, straten, een brug, auto's en bussen, rook en wolken",,,,38,23,31
1209,Tableau,content,"Jésus entouré de personnes, des gardes, une ville en fond","Jesus surrounded by people, guards, a city in the background","Jezus omringd door mensen, bewakers, een stad op de achtergrond",,,,20,14,24
4561,Tableau,content,"Un vase sur une table avec des fleurs, des pétales sur la table","A vase on a table with flowers, petals on the table","Een vaas op een tafel met bloemen, bloemblaadjes op tafel",,,,18,14,21
5292,Dessin,content,"Une statue d'une personne assise à côté d'un escalier, une table","A statue of a person sitting next to a staircase, a table","Een standbeeld van een persoon die naast een trap zit, een tafel",,,,23,15,21
4996,Tableau,content,"Un portrait d'une femme en robe avec un chapeau, une ville ne fond, un tour dans la ville","A portrait of a woman in a dress with a hat, a city does not melt, a tour in the city","Een portret van een vrouw in een jurk met een hoed, een stad smelt niet, een tour in de stad",,,,26,25,32
3663,Tableau,content,Des religieux agenouillés devant un homme nu dans une église,Religious kneeling in front of a naked man in a church,Religieus knielend voor een naakte man in een kerk,,,,19,14,17
6456,Dessin,content,"Un portrait d'un homme, il regarde vers la gauche, il a des cheveux courts","A portrait of a man, he looks to the left, he has short hair","Een portret van een man, hij kijkt naar links, hij heeft kort haar",,,,24,18,25
4434,Tableau,content,"Une femme alarmée tient dans ses bras son enfant, on voit des personnes la regarder en fond","An alarmed woman holds her child in her arms, you see people looking at her in the background","Een gealarmeerde vrouw houdt haar kind in haar armen, je ziet mensen naar haar kijken op de achtergrond",,,,27,22,36
6090,Dessin,content,"Un portrait d'un homme avec un monocle, il est bien habillé, il a une moustache et des cheveux dégarni","A portrait of a man with a monocle, he's well dressed, he's got a mustache and he's got his hair cut out.","Een portret van een man met een monocle, hij is goed gekleed, hij heeft een snor en hij heeft zijn haar eruit geknipt.",,,,33,32,45
7069,Dessin,content,"Le bord d'une rive avec des arbres, un homme est assis avec un bouc, son chien et d'autres animaux, des maisons en fond","The edge of a bank with trees, a man sits with a goat, his dog and other animals, houses in the background","De rand van een oever met bomen, een man zit met een geit, zijn hond en andere dieren, huizen op de achtergrond",,,,40,27,39
7281,Tableau,content,"Un vieil homme assis avec un livre en face de lui, une jeune femme avec le regard inquiet, des livres","An old man sitting with a book in front of him, a young woman with anxious eyes, books","Een oude man met een boek voor zich, een jonge vrouw met angstige ogen, boeken",,,,31,22,29
7304,Dessin,content,"Un jardin avec des arbres, une personne avec un chien au centre, une cloture en bois, une maison de campagne en fond","A garden with trees, a person with a dog in the center, a wooden fence, a country house in the background","Een tuin met bomen, een persoon met een hond in het midden, een houten hek, een landhuis op de achtergrond",,,,32,26,37
10844,Dessin,content,"Des personnes en intérieur à une table, un homme se fait laver le pied, les personnes observent","People indoors at a table, a man gets his foot washed, people watch","Mensen binnen aan een tafel, een man laat zijn voet wassen, mensen kijken",,,,28,17,27
1616,Tableau,content,"Une forêt, des montagnes, de l'eau, des cavaliers sur des chevaux, des arbres en avant plan, des nuages, un fort","A forest, mountains, water, horse riders, trees in the foreground, clouds, a fort","Een bos, bergen, water, ruiters, bomen op de voorgrond, wolken, een fort",,,,36,21,26
1346,Tableau,content,"Un homme sur un cheval, une batiment, de l'eau, un pont, des nuages, des vaches, un crépuscule","A man on a horse, a building, water, a bridge, clouds, cows, a twilight","Een man op een paard, een gebouw, water, een brug, wolken, koeien, een schemering",,,,35,22,30
6467,Tableau,content,"Un rivière qui coule dans une forêt, des arbres avec des feuilles jaunes, l'automne","A river flowing into a forest, trees with yellow leaves, autumn","Een rivier die in een bos stroomt, bomen met gele bladeren, herfst",,,,29,15,25
7689,Tableau,content,"Des hommes barbus et moustachus qui discutent, costumes, journal, discussion, débat","Bearded and mustachus men who discuss, costumes, newspaper, discussion, debate","Bebaarde en snorren mannen die bespreken, kostuums, krant, discussie, debat",,,,25,18,28
2477,Tableau,content,"Des poulets, un coq, poulailler","Chickens, roosters, hens","Kippen, haantjes, kippen",,,,13,7,11
5124,Dessin,content,"Des boites colorées sur une table, parfums, flacons, miroir, salle de bain","Colourful boxes on a table, perfumes, bottles, mirror, bathroom","Kleurrijke dozen op een tafel, parfums, flessen, spiegel, badkamer",,,,25,16,24
8078,Tableau,content,"Portrait d'une femme, cheveux bruns, diadème, habit traditionnel, collier de perles, miroir","Portrait of a woman, brown hair, diadem, traditional dress, pearl necklace, mirror","Portret van een vrouw, bruin haar, diadem, traditionele jurk, parel ketting, spiegel",,,,30,21,30
7155,Tableau,content,"Des ouvriers et une ouvrière qui marchent, travail manuel, saleté, fermiers, paysage désolé, pauvreté","Workers and a worker who walk, manual work, dirt, farmers, desolate landscape, poverty","Arbeiders en arbeiders die lopen, handwerk, vuil, boeren, verlaten landschap, armoede",,,,39,21,32
