recordID,category,focus,caption_fr,caption_en,caption_nl,additional_info_fr,additional_info_en,additional_info_nl,tokenized_length_fr,tokenized_length_en,tokenized_length_nl
3663,Tableau,emotion,Des religieux agenouillés devant un homme nu dans une église,Religious kneeling in front of a naked man in a church,Religieus knielend voor een naakte man in een kerk,['Émotion peur'],['Fear emotion'],['Angst emotie'],23,16,20
8318,Dessin,emotion,"Un homme de côté avec un chapeau et un manteau, des bottes, homme debout","A man on the side with a hat and a coat, boots, standing man","Een man aan de zijkant met een hoed en een jas, laarzen, staande man","['Émotion joie', 'Émotion surprise']","['Joy emotion', 'Surprise emotion']","['Vreugde-emotie', 'Verrast emotie']",33,23,36
2030,Dessin,emotion,"Le prêtre lit un texte, des hommes assis et debouts le regarde","The priest reads a text, men sitting and standing looking at it","De priester leest een tekst, mannen zitten en staan er naar te kijken.","['Émotion peur', 'Émotion colère']","['Fear emotion', 'Anger emotion']","['Angst emotie', 'Boosheid emotie']",31,20,35
1811,Tableau,emotion,"Des hommes et des femmes autour d'un berceau, naissance, famille, intérieur","Men and women around a cradle, birth, family, interior","Mannen en vrouwen rond een wieg, geboorte, familie, interieur",['Émotion joie'],['Joy emotion'],['Vreugde-emotie'],31,16,31
1436,Tableau,emotion,"Une table avec de la nourriture, un homard, des biscuits, du pain, des olives, des verres","A table with food, lobster, biscuits, bread, olives, glasses","Een tafel met voedsel, kreeft, koekjes, brood, olijven, glazen",['Émotion surprise'],['Surprise emotion'],['Verrast emotie'],31,18,32
8041,Tableau,emotion,"Un taverne avec des tables où des gens boivent et mangent, des femmes, un jeu, drague","A tavern with tables where people drink and eat, women, a game, dredge","Een taverne met tafels waar mensen drinken en eten, vrouwen, een spel, dreggen","['Émotion joie', 'Émotion colère']","['Joy emotion', 'Anger emotion']","['Vreugde-emotie', 'Boosheid emotie']",38,23,41
6497,Dessin,emotion,"Un homme assis qui dessine, des animaux, des arbres, une ville en fond, une rivière","A sitting man drawing, animals, trees, a town in the background, a river","Een zittende man tekenen, dieren, bomen, een stad op de achtergrond, een rivier",['Émotion neutre'],['Neutral emotion'],['Emotie neutraal'],32,21,34
172,Dessin,emotion,"Une place avec un monument, un batiment, du brouillard","A place with a monument, a building, fog","Een plek met een monument, een gebouw, mist",['Émotion peur'],['Fear emotion'],['Angst emotie'],19,14,18
4133,Tableau,emotion,"Une rivière qui coule, des prairies, une forêt, des rochers dans l'eau","A river flowing, meadows, a forest, rocks in the water","Een rivier stroomt, weiden, een bos, rotsen in het water",['Émotion peur'],['Fear emotion'],['Angst emotie'],30,17,23
4286,Dessin,emotion,"Un fleuve avec deux bateaux, un pont et une ville, de la fumée qui sort des usines, un parc","A river with two boats, a bridge and a city, smoke coming out of the factories, a park","Een rivier met twee boten, een brug en een stad, rook die uit de fabrieken komt, een park","['Émotion Tristesse', 'Émotion colère']","['Sadness emotion', 'Anger emotion']","['Verdriet emotie', 'Boosheid emotie']",40,28,41
7099,Tableau,emotion,"Des animaux, vaches, moutons, chèvres, ferme en fond, arbres","Animals, cows, sheep, goats, farm in the background, trees","Dieren, koeien, schapen, geiten, boerderij op de achtergrond, bomen","['Émotion neutre', 'Émotion joie']","['Neutral emotion', 'Joy emotion']","['Emotie neutraal', 'Vreugde-emotie']",35,21,41
10351,Dessin,emotion,Un dessin d'un personnage couché avec un habit ample sur lui,A drawing of a character lying with a large dress on him,Een tekening van een personage liggend met een grote jurk op hem,['Émotion neutre'],['Neutral emotion'],['Emotie neutraal'],24,16,25
7479,Tableau,emotion,"Un femme en robe verte écoute un homme en tenue noire, intérieur, une fenêtre derrière","A woman in a green dress listens to a man in black outfit, inside, a window behind","Een vrouw in een groene jurk luistert naar een man in zwarte outfit, binnen, een raam achter","['Émotion dégoût', 'Émotion colère']","['Disgust emotion', 'Anger emotion']","['Walging emotie', 'Boosheid emotie']",43,27,44
5292,Dessin,emotion,"Une statue d'une personne assise à côté d'un escalier, une table","A statue of a person sitting next to a staircase, a table","Een standbeeld van een persoon die naast een trap zit, een tafel",['Émotion peur'],['Fear emotion'],['Angst emotie'],27,17,24
8074,Tableau,emotion,"Une biche qui court dans la forêt, des arbres, chasse, paysage","A biche running in the forest, trees, hunting, landscape","Een biche in het bos, bomen, jagen, landschap",['Émotion peur'],['Fear emotion'],['Angst emotie'],26,17,21
6573,Dessin,emotion,"Une ville en ruine, des gravats sur le sol, une église détruite, l'après guerre","A city in ruins, rubble on the ground, a church destroyed, post-war","Een stad in ruïnes, puin op de grond, een kerk verwoest, na de oorlog","['Émotion peur', 'Émotion colère']","['Fear emotion', 'Anger emotion']","['Angst emotie', 'Boosheid emotie']",38,24,37
7936,Dessin,emotion,"biche, vu de profil, animal","bish, from profile, animal","bish, van profiel, dier",['Émotion surprise'],['Surprise emotion'],['Verrast emotie'],14,10,15
4434,Tableau,emotion,"Une femme alarmée tient dans ses bras son enfant, on voit des personnes la regarder en fond","An alarmed woman holds her child in her arms, you see people looking at her in the background","Een gealarmeerde vrouw houdt haar kind in haar armen, je ziet mensen naar haar kijken op de achtergrond",['Émotion peur'],['Fear emotion'],['Angst emotie'],31,24,39
1277,Tableau,emotion,"Une forêt dense, des troncs, un ruisseau, des roches, des feuilles vertes","A dense forest, trunks, a stream, rocks, green leaves","Een dicht bos, stammen, een beek, rotsen, groene bladeren",['Émotion peur'],['Fear emotion'],['Angst emotie'],30,17,24
1332,Tableau,emotion,"Un paysage avec un chemin avec une princesse et des gardes, des enfants, une croix, eau, arbres, église en fond","A landscape with a path with a princess and guards, children, a cross, water, trees, church in the background","Een landschap met een pad met een prinses en bewakers, kinderen, een kruis, water, bomen, kerk op de achtergrond","['Émotion joie', 'Émotion surprise']","['Joy emotion', 'Surprise emotion']","['Vreugde-emotie', 'Verrast emotie']",43,31,51
6492,Dessin,emotion,"Paysage avec des arbres en premier plan et une ville en arrière plan, muraille","Landscape with trees in the foreground and a city in the background, wall","Landschap met bomen op de voorgrond en een stad op de achtergrond, muur",['Émotion neutre'],['Neutral emotion'],['Emotie neutraal'],26,18,30
10861,Tableau,emotion,"Portrait d'une jeune femme avec un collier de perles, cheveux coiffés, boucles d'oreilles, sourire","Portrait of a young woman with a necklace of pearls, hair styled, earrings, smile","Portret van een jonge vrouw met een ketting van parels, haar gestileerd, oorbellen, glimlach",['Émotion joie'],['Joy emotion'],['Vreugde-emotie'],37,21,41
1100,Tableau,emotion,"Un champ de blé, des maisons, des arbres avec des feuilles vertes, une haie, des nuages dans le ciel","A field of wheat, houses, trees with green leaves, a hedge, clouds in the sky","Een veld van tarwe, huizen, bomen met groene bladeren, een heg, wolken in de lucht",['Émotion joie'],['Joy emotion'],['Vreugde-emotie'],37,23,36
959,Tableau,emotion,"Un portrait d'une femme avec un habit bleu et blanc, elle a ses cheveux attachés, une rose dans la main, un médaillon en or","A portrait of a woman with a blue and white dress, she has her hair tied, a rose in her hand, a gold medallion","Een portret van een vrouw met een blauwe en witte jurk, ze heeft haar haar vastgebonden, een roos in haar hand, een gouden medaillon","['Émotion neutre', 'Émotion dégoût']","['Neutral emotion', 'Disgust emotion']","['Emotie neutraal', 'Walging emotie']",48,35,53
1096,Tableau,emotion,"Une ville, des toits, une église, abstrait","A city, roofs, a church, abstract","Een stad, daken, een kerk, abstract","['Émotion peur', 'Émotion surprise']","['Fear emotion', 'Surprise emotion']","['Angst emotie', 'Verrast emotie']",24,16,22
7547,Tableau,emotion,"Un femme ouvrière de profil avec un foulard bleu, des toîts, elle regarde, de la fumée","A woman profile worker with a blue scarf, toises, she looks, smoke","Een vrouw profiel werknemer met een blauwe sjaal, toises, ze kijkt, rook","['Émotion neutre', 'Émotion Tristesse']","['Neutral emotion', 'Sadness emotion']","['Emotie neutraal', 'Verdriet emotie']",41,23,39
2441,Tableau,emotion,"Un intérieur avec beaucoup de tableaux, des artistes, vente d'art","An interior with many paintings, artists, art sale","Een interieur met vele schilderijen, kunstenaars, kunstverkoop",['Émotion surprise'],['Surprise emotion'],['Verrast emotie'],26,14,30
4320,Tableau,emotion,"Un panier avec pommes sur une table avec une tasse, des fleurs dans un vase rouge, des livres, du papier peint","A basket with apples on a table with a cup, flowers in a red vase, books, wallpaper","Een mand met appels op een tafel met een kopje, bloemen in een rode vaas, boeken, behang",['Émotion joie'],['Joy emotion'],['Vreugde-emotie'],37,24,35
8693,Tableau,emotion,"Un berger qui mène son troupeau de moutons dans la forêt, une prairie","A shepherd who leads his flock of sheep into the forest, a meadow","Een herder die zijn kudde schapen het bos inleidt, een weide","['Émotion Tristesse', 'Émotion peur']","['Sadness emotion', 'Fear emotion']","['Verdriet emotie', 'Angst emotie']",34,21,32
5950,Tableau,emotion,"Un combat entre des soldats, boucliers, lances, mort","A battle between soldiers, shields, spears, dead","Een strijd tussen soldaten, schilden, speren, dood.","['Émotion Tristesse', 'Émotion peur', 'Émotion colère']","['Sadness emotion', 'Fear emotion', 'Anger emotion']","['Verdriet emotie', 'Angst emotie', 'Boosheid emotie']",32,20,36
10844,Dessin,emotion,"Des personnes en intérieur à une table, un homme se fait laver le pied, les personnes observent","People indoors at a table, a man gets his foot washed, people watch","Mensen binnen aan een tafel, een man laat zijn voet wassen, mensen kijken","['Émotion dégoût', 'Émotion colère', 'Émotion surprise']","['Disgust emotion', 'Anger emotion', 'Surprise emotion']","['Walging emotie', 'Boosheid emotie', 'Verrast emotie']",44,26,43
5011,Tableau,emotion,"Un femme nue dans une forêt magique, des arbres en or, un paon doré, de l'eau calme, le paradis","A naked woman in a magical forest, golden trees, a golden peacock, calm water, paradise","Een naakte vrouw in een magisch bos, gouden bomen, een gouden pauw, kalm water, paradijs","['Émotion joie', 'Émotion surprise']","['Joy emotion', 'Surprise emotion']","['Vreugde-emotie', 'Verrast emotie']",44,28,44
10869,Dessin,emotion,Un prêtre prononce un sermon les mains écartées et le regard tourné vers le ciel,A priest delivers a sermon with his hands apart and his eyes turned toward heaven,Een priester geeft een preek met zijn handen uit elkaar en zijn ogen draaien naar de hemel,"['Émotion joie', 'Émotion surprise']","['Joy emotion', 'Surprise emotion']","['Vreugde-emotie', 'Verrast emotie']",34,22,44
10330,Dessin,emotion,"Portrait d'une femme accoudée sur un rebord, cheveux coiffés, mains qui se tiennent","Portrait of a woman leaning on a ledge, hairy hair, hands standing","Portret van een vrouw leunend op een richel, harig haar, handen staan",['Émotion joie'],['Joy emotion'],['Vreugde-emotie'],34,18,32
7980,Tableau,emotion,"Deux jeunes femmes dans le jardin sur le chemin, religieuse, long vêtements blanc et noir, arbustes","Two young women in the garden on the way, nun, long white and black clothes, shrubs","Twee jonge vrouwen in de tuin onderweg, non, lange witte en zwarte kleding, struiken",['Émotion Tristesse'],['Sadness emotion'],['Verdriet emotie'],36,23,37
7416,Tableau,emotion,"Des marécages avec des arbres, dans le fond un village, de l'eau bleue","Marshes with trees, in the bottom a village, blue water","Marsen met bomen, in de bodem een dorp, blauw water",['Émotion joie'],['Joy emotion'],['Vreugde-emotie'],27,16,25
2290,Tableau,emotion,"Un portrait d'un homme, fraise cou, cheveux bruns, moustache et bouc, miroir","A portrait of a man, strawberry neck, brown hair, mustache and goat, mirror","Een portret van een man, aardbeienhals, bruin haar, snor en geit, spiegel",['Émotion neutre'],['Neutral emotion'],['Emotie neutraal'],31,21,31
7114,Dessin,emotion,"Un port avec des voiliers et des marins, la mer, des voiliers sur l'eau, un ciel nuageux, la plage de cailloux","A port with sailboats and sailors, the sea, sailboats on the water, a cloudy sky, the pebbly beach","Een haven met zeilboten en zeilers, de zee, zeilboten op het water, een bewolkte hemel, het kiezelstrand",['Émotion peur'],['Fear emotion'],['Angst emotie'],44,29,39
1616,Tableau,emotion,"Une forêt, des montagnes, de l'eau, des cavaliers sur des chevaux, des arbres en avant plan, des nuages, un fort","A forest, mountains, water, horse riders, trees in the foreground, clouds, a fort","Een bos, bergen, water, ruiters, bomen op de voorgrond, wolken, een fort",['Émotion joie'],['Joy emotion'],['Vreugde-emotie'],40,23,32
1467,Tableau,emotion,"Rue avec des maisons mitoyennes, ruelles, cheminées, façades","Street with terraced houses, alleys, fireplaces, facades","Straat met rijtjeshuizen, steegjes, open haarden, gevels","['Émotion Tristesse', 'Émotion peur']","['Sadness emotion', 'Fear emotion']","['Verdriet emotie', 'Angst emotie']",32,21,30
1281,Tableau,emotion,"La mer avec des vagues, des voiliers sur l'eau, une personne au bord de l'eau, un ciel nuageux","The sea with waves, sailboats on the water, a person by the water, a cloudy sky","De zee met golven, zeilboten op het water, een persoon bij het water, een bewolkte lucht",['Émotion peur'],['Fear emotion'],['Angst emotie'],38,24,34
4996,Tableau,emotion,"Un portrait d'une femme en robe avec un chapeau, une ville ne fond, un tour dans la ville","A portrait of a woman in a dress with a hat, a city does not melt, a tour in the city","Een portret van een vrouw in een jurk met een hoed, een stad smelt niet, een tour in de stad","['Émotion neutre', 'Émotion peur']","['Neutral emotion', 'Fear emotion']","['Emotie neutraal', 'Angst emotie']",35,30,41
6141,Dessin,emotion,"Un homme musclé porte un homme nu, combat, porter","A muscular man wears a naked man, fights, wears","Een gespierde man draagt een naakte man, vecht, draagt","['Émotion peur', 'Émotion colère']","['Fear emotion', 'Anger emotion']","['Angst emotie', 'Boosheid emotie']",24,18,30
4081,Tableau,emotion,"Un marécage, eau, roseau, forêt","A swamp, water, reed, forest","Een moeras, water, riet, bos","['Émotion peur', 'Émotion dégoût']","['Fear emotion', 'Disgust emotion']","['Angst emotie', 'Walging emotie']",27,16,20
7975,Tableau,emotion,"Portrait d'un jeune homme avec une légère moustache torse nu qui regarde vers le haut, cheveux courts","Portrait of a young man with a light naked torso mustache looking up, short hair","Portret van een jongeman met een lichte naakte romp snor omhoog kijken, kort haar",['Émotion joie'],['Joy emotion'],['Vreugde-emotie'],34,21,37
5304,Dessin,emotion,Une femme assise avec un foulard lit un livre avec une lampe de lecture,A woman sitting with a scarf reads a book with a reading lamp,Een vrouw met een sjaal leest een boek met een leeslamp,"['Émotion neutre', 'Émotion joie', 'Émotion Tristesse']","['Neutral emotion', 'Joy emotion', 'Sadness emotion']","['Emotie neutraal', 'Vreugde-emotie', 'Verdriet emotie']",35,23,38
1501,Tableau,emotion,"Un vendeur ends des animaux à une fermière et sa fille, chapeau, fromage","A seller end of the animals to a farmer and her daughter, hat, cheese","Een verkoper einde van de dieren aan een boer en haar dochter, hoed, kaas","['Émotion joie', 'Émotion surprise']","['Joy emotion', 'Surprise emotion']","['Vreugde-emotie', 'Verrast emotie']",35,23,37
5752,Tableau,emotion,"Une foule, centre-ville, église, place, défilé, fête, carnaval, ville","A crowd, downtown, church, square, parade, party, carnival, city","Een menigte, centrum, kerk, plein, parade, feestje, carnaval, stad","['Émotion joie', 'Émotion surprise']","['Joy emotion', 'Surprise emotion']","['Vreugde-emotie', 'Verrast emotie']",35,23,36
2150,Tableau,emotion,"Des soldats sur des cheveaux, vu de proche, uniformes, nuages, chapeaux","Soldiers on horses, seen from near, uniforms, clouds, hats","Soldaten op paarden, gezien van dichtbij, uniformen, wolken, hoeden","['Émotion peur', 'Émotion colère']","['Fear emotion', 'Anger emotion']","['Angst emotie', 'Boosheid emotie']",35,20,36
4565,Tableau,emotion,"Un paysage plat avec une prairie et un ciel dégagé, vache","A flat landscape with a meadow and a clear sky, cow","Een vlak landschap met een weide en een heldere lucht, koe",['Émotion neutre'],['Neutral emotion'],['Emotie neutraal'],24,16,26
8500,Dessin,emotion,"Des moulins sur le bord de l'eau, des barques, des voiliers sur l'eai, des roseaux, des personnes sur le bord de l'eau","Mills on the edge of the water, boats, sailboats on the eai, reeds, people on the edge of the water","Millen aan de rand van het water, boten, zeilboten op de eai, riet, mensen aan de rand van het water",['Émotion neutre'],['Neutral emotion'],['Emotie neutraal'],45,31,39
6193,Dessin,emotion,"Un dessin d'un visage d'une femme avec les cheveux attachés, elle regarde vers le bas","A drawing of a woman's face with her hair tied, she looks down","Een tekening van het gezicht van een vrouw met haar haar vastgebonden, ze kijkt naar beneden",['Émotion joie'],['Joy emotion'],['Vreugde-emotie'],32,19,37
10814,Dessin,emotion,"Un homme parle à une femme qui le regarde, la femme a les bras écartés, l'homme porte quelque chose dans sa main","A man speaks to a woman who looks at him, the woman has her arms spread apart, the man carries something in his hand","Een man spreekt met een vrouw die naar hem kijkt, de vrouw heeft haar armen uit elkaar, de man draagt iets in zijn hand","['Émotion peur', 'Émotion colère']","['Fear emotion', 'Anger emotion']","['Angst emotie', 'Boosheid emotie']",42,33,52
5495,Tableau,emotion,"Jésus qui parle à des personnes, un vieil homme avec une barbe blanche, une femme avec un foulard sur la tête, deux hommes d'église","Jesus speaking to people, an old man with a white beard, a woman with a scarf on her head, two churchmen","Jezus sprak met mensen, een oude man met een witte baard, een vrouw met een sjaal op haar hoofd, twee kerkmannen","['Émotion peur', 'Émotion dégoût', 'Émotion colère', 'Émotion surprise']","['Fear emotion', 'Disgust emotion', 'Anger emotion', 'Surprise emotion']","['Angst emotie', 'Walging emotie', 'Boosheid emotie', 'Verrast emotie']",64,39,62
8511,Tableau,emotion,"Une ville portuaire, des tentes, bateaux, eau, voiliers, chevaux","A port city, tents, boats, water, sailboats, horses","Een havenstad, tenten, boten, water, zeilboten, paarden","['Émotion joie', 'Émotion surprise']","['Joy emotion', 'Surprise emotion']","['Vreugde-emotie', 'Verrast emotie']",30,21,33
8273,Tableau,emotion,"Un voilier sur l'eau avec des voiliers derrière, barque, ville en fond, ciel nuageux","A sailboat on the water with sailboats behind, boat, city in the background, cloudy sky","Een zeilboot op het water met zeilboten achter, boot, stad op de achtergrond, bewolkte lucht",['Émotion surprise'],['Surprise emotion'],['Verrast emotie'],34,24,38
6932,Dessin,emotion,Dessin d'un corps musclé d'un homme,Drawing of a man's muscular body,Tekening van het gespierde lichaam van een man,['Émotion peur'],['Fear emotion'],['Angst emotie'],19,11,19
123,Tableau,emotion,"Un homme musclé et des femmes nues, un temple, le paradis, un ange, nuages, dieu","A muscular man and naked women, a temple, paradise, an angel, clouds, god","Een gespierde man en naakte vrouwen, een tempel, een paradijs, een engel, wolken, god","['Émotion joie', 'Émotion surprise']","['Joy emotion', 'Surprise emotion']","['Vreugde-emotie', 'Verrast emotie']",37,25,44
1188,Tableau,emotion,"Un animal blanc dans la fôret, de la végétation, la chasse","A white animal in the forest, vegetation, hunting","Een wit dier in het bos, vegetatie, jagen",['Émotion peur'],['Fear emotion'],['Angst emotie'],26,14,18
8729,Tableau,emotion,"Deux hommes qui regardent des livres, une femme avec un enfant, un marché dans la rue","Two men watching books, a woman with a child, a street market","Twee mannen kijken naar boeken, een vrouw met een kind, een straatmarkt","['Émotion neutre', 'Émotion colère']","['Neutral emotion', 'Anger emotion']","['Emotie neutraal', 'Boosheid emotie']",34,21,38
4988,Tableau,emotion,"Plusieurs personnes, des chevaux, un puit, un chateau en fond, des arbres, une montagne, promenade, convoi","Several people, horses, a well, a castle in the background, trees, a mountain, walk, convoy","Verschillende mensen, paarden, een put, een kasteel op de achtergrond, bomen, een berg, wandelen, konvooi",['Émotion joie'],['Joy emotion'],['Vreugde-emotie'],38,26,44
1095,Tableau,emotion,"Formes géométriques, abstrait, arbre, maison, rue","Geometrical shapes, abstract, tree, house, street","Geometrische vormen, abstract, boom, huis, straat","['Émotion peur', 'Émotion surprise']","['Fear emotion', 'Surprise emotion']","['Angst emotie', 'Verrast emotie']",28,19,26
1524,Tableau,emotion,"Un temple avec une foule qui regardent, des soldats arrivent, un arbre, personnes alignées, arc","A temple with a crowd watching, soldiers coming, a tree, people aligned, bow","Een tempel met een menigte kijken, soldaten komen, een boom, mensen uitgelijnd, boog","['Émotion peur', 'Émotion surprise']","['Fear emotion', 'Surprise emotion']","['Angst emotie', 'Verrast emotie']",38,24,42
7281,Tableau,emotion,"Un vieil homme assis avec un livre en face de lui, une jeune femme avec le regard inquiet, des livres","An old man sitting with a book in front of him, a young woman with anxious eyes, books","Een oude man met een boek voor zich, een jonge vrouw met angstige ogen, boeken","['Émotion Tristesse', 'Émotion peur', 'Émotion surprise']","['Sadness emotion', 'Fear emotion', 'Surprise emotion']","['Verdriet emotie', 'Angst emotie', 'Verrast emotie']",45,30,44
4576,Tableau,emotion,"Un paysage avec un ciel nuageux, un lac en fond et un arbre en avant plan","A landscape with a cloudy sky, a lake in the background and a tree in the foreground","Een landschap met een bewolkte hemel, een meer op de achtergrond en een boom op de voorgrond","['Émotion Tristesse', 'Émotion peur']","['Sadness emotion', 'Fear emotion']","['Verdriet emotie', 'Angst emotie']",34,25,40
4168,Tableau,emotion,"Une barrière dans un champ, des prairies, le ciel nuageux","A barrier in a field, meadows, cloudy sky","Een slagboom in een veld, weiden, bewolkte lucht","['Émotion Tristesse', 'Émotion peur']","['Sadness emotion', 'Fear emotion']","['Verdriet emotie', 'Angst emotie']",29,17,28
5804,Dessin,emotion,"Un paysage avec des arbres, des collines, des animaux qui courent, de l'herbe","A landscape with trees, hills, animals running, grass","Een landschap met bomen, heuvels, rendieren, gras",['Émotion neutre'],['Neutral emotion'],['Emotie neutraal'],31,15,23
1350,Tableau,emotion,"Portrait d'une femme avec un noeud dans ses cheveux, cheveux blancs, grand-mère","Portrait of a woman with a knot in her hair, white hair, grandmother","Portret van een vrouw met een knoop in haar haar, wit haar, grootmoeder","['Émotion neutre', 'Émotion joie']","['Neutral emotion', 'Joy emotion']","['Emotie neutraal', 'Vreugde-emotie']",37,22,37
3921,Tableau,emotion,"Portrait d'une femme assise de profil, cheveux roux, lunettes de lecture, oiseau","Portrait of a woman sitting profile, red hair, reading glasses, bird","Portret van een vrouw zitten profiel, rood haar, leesbril, vogel",['Émotion neutre'],['Neutral emotion'],['Emotie neutraal'],31,18,29
5301,Dessin,emotion,"Un porte ouverte, une chambre, un lit, une table, un chapeau, des tableaux sur le mur, intérieur, appartement","An open door, a bedroom, a bed, a table, a hat, paintings on the wall, interior, apartment","Een open deur, een slaapkamer, een bed, een tafel, een hoed, schilderijen aan de muur, interieur, appartement","['Émotion joie', 'Émotion peur']","['Joy emotion', 'Fear emotion']","['Vreugde-emotie', 'Angst emotie']",47,31,51
2097,Tableau,emotion,"Jésus mort avec une femme et une homme agenouillé contre lui, un homme en uniforme militaire qui prie, décès","Jesus died with a woman and a man kneeling against him, a man in military uniform praying, dying","Jezus stierf met een vrouw en een man knielend tegen hem, een man in militair uniform biddend, stervend","['Émotion Tristesse', 'Émotion peur']","['Sadness emotion', 'Fear emotion']","['Verdriet emotie', 'Angst emotie']",45,28,45
6372,Tableau,emotion,"Vache, Ane, Chèvre, Bouc, Mouton, Arbre, Tronc, Chaine, Champ","Vache, Ane, Goat, Bouc, Mouton, Tree, Trunk, Chain, Field","Vache, Ane, Geit, Bouc, Mouton, Tree, Trunk, Chain, Field",['Émotion neutre'],['Neutral emotion'],['Emotie neutraal'],31,24,28
5162,Dessin,emotion,"Un groupe d'aventuriers découvrent une vallée, arbres, falaise, découverte","A group of adventurers discover a valley, trees, cliff, discovery","Een groep avonturiers ontdekt een vallei, bomen, klif, ontdekking",['Émotion surprise'],['Surprise emotion'],['Verrast emotie'],31,18,30
